{
  "record_meta": {
    "study_id": "estoos_2023",
    "reviewer": "deepseek",
    "model": "deepseek-v4-flash-vision-exp",
    "assessment_date": "2026-09-28",
    "source_file": "studies/fulltext/1-s2.0-S0883944123000230-main.pdf",
    "schema_version": "1.0.0"
  },
  "study_id": "estoos_2023",
  "tool": "nih_cohort",
  "results": [],
  "nih": {
    "items": {
      "1": {
        "response": "Yes",
        "support": "Given the potential benefit of an optimized PEEP strategy in VV ECMO patients, in January 2021, we transitioned to an optimal PEEP strategy with the hypothesis that optimal PEEP would be associated with lower rates of RV dysfunction and higher rates of successful weaning from VV ECMO.",
        "location": "p. 1, Introduction, final paragraph"
      },
      "2": {
        "response": "Yes",
        "support": "This was a retrospective study of all COVID-19 ECMO patients initiated on VV ECMO from March 2020 through November 2021. All patients were hospitalized at OHSU, an academic medical center in Portland, OR with an intensivist-run VV ECMO program",
        "location": "p. 2, Materials and methods, 2.1 Study design and setting"
      },
      "3": {
        "response": "Yes",
        "support": "Seventy-two patients were identified. Three were excluded with two being transferred immediately after cannulation to other centers given capacity limitations and one dying during cannulation after an arterial injury. Of the 69 included patients, 25 were in the standard PEEP group and 44 in the optimal PEEP group.",
        "location": "p. 2, Results, first paragraph"
      },
      "4": {
        "response": "Yes",
        "support": "This was a retrospective study of all COVID-19 ECMO patients initiated on VV ECMO from March 2020 through November 2021. All patients were hospitalized at OHSU ... with an intensivist-run VV ECMO program",
        "location": "p. 2, Materials and methods, 2.1 Study design and setting; p. 2, Results, first paragraph (exclusions)"
      },
      "5": {
        "response": "No",
        "support": "The report contains no sample size calculation, power description, or a priori variance/effect estimate used to justify the number of patients studied; the statistical methods section describes only the comparison tests and regression approach used.",
        "location": "p. 2, Materials and methods, 2.5 Statistical analysis"
      },
      "6": {
        "response": "Yes",
        "support": "Starting in January 2021, our program switched to an optimal PEEP strategy wherein PEEP was titrated daily using esophageal manometry to an end-expiratory transpulmonary pressure of 0-3 cm H2O throughout the ECMO run",
        "location": "p. 2, Materials and methods, 2.2 Intervention; p. 2, 2.4 Outcome measures"
      },
      "7": {
        "response": "Yes",
        "support": "there was no difference in ECMO duration with an average run of approximately 22 days in both groups and no difference in ICU or hospital LOS",
        "location": "p. 3, Results; p. 3, Table 3 (ECMO duration, ICU LOS, hospital LOS, survival to discharge)"
      },
      "8": {
        "response": "NA",
        "support": "The exposure is a dichotomous comparison of two ventilation strategies (standard PEEP vs. optimal PEEP); the report does not analyse categories or a continuous gradient of PEEP in relation to outcomes.",
        "location": "p. 2, Materials and methods, 2.2 Intervention; p. 3, Tables 2 and 3"
      },
      "9": {
        "response": "Yes",
        "support": "Prior to January 2021, our VV ECMO program routinely utilized pressure control ventilation with an inspiratory pressure of 10 cm H2O, PEEP of 10 cm H2O, and a rate of 10 breaths per minute. Starting in January 2021, our program switched to an optimal PEEP strategy wherein PEEP was titrated daily using esophageal manometry to an end-expiratory transpulmonary pressure of 0-3 cm H2O",
        "location": "p. 2, Materials and methods, 2.2 Intervention"
      },
      "10": {
        "response": "Yes",
        "support": "PEEP was titrated daily using esophageal manometry to an end-expiratory transpulmonary pressure of 0-3 cm H2O throughout the ECMO run",
        "location": "p. 2, Materials and methods, 2.2 Intervention; p. 3, Table 2 (mean PEEP day 2 and day 7)"
      },
      "11": {
        "response": "Yes",
        "support": "The primary outcome was the incidence of hemodynamically significant RV dysfunction on echocardiogram (tricuspid annular plane systolic excursion <1.7 cm) requiring inotropic support. Secondary outcomes included ECMO duration, survival to ECMO decannulation, survival to hospital discharge",
        "location": "p. 2, Materials and methods, 2.4 Outcome measures; p. 3, Table 3"
      },
      "12": {
        "response": "NR",
        "support": "The report does not state whether the persons assessing outcomes (echocardiographic RV dysfunction, survival to decannulation and discharge) were blinded to the PEEP strategy the patient received.",
        "location": "p. 2, Materials and methods, 2.3 Data collection and 2.4 Outcome measures"
      },
      "13": {
        "response": "Yes",
        "support": "Seventy-two patients were identified. Three were excluded with two being transferred immediately after cannulation to other centers given capacity limitations and one dying during cannulation after an arterial injury. Of the 69 included patients, 25 were in the standard PEEP group and 44 in the optimal PEEP group.",
        "location": "p. 2, Results, first paragraph; p. 3, Table 3"
      },
      "14": {
        "response": "Yes",
        "support": "Multivariate logistic regression examining the effect of optimal PEEP after accounting for the effects of age, history of hypertension and diabetes, and date of hospital admission on onset of RV dysfunction were also significant with an OR of 0.07 (95% CI = 0.004-0.47, p = 0.02).",
        "location": "p. 3, Results, logistic regression paragraph; p. 3, Table 4"
      }
    },
    "rating": "Fair",
    "rationale": "The study is a single-centre retrospective cohort with a clear question (Q1), a well-defined consecutive population (Q2, Q3, Q4), well-described and consistently applied exposure (optimal vs. standard PEEP strategy; Q9) that was re-assessed daily (Q10), well-defined outcomes including an objective echo-based primary outcome and mortality endpoints (Q11), essentially complete follow-up (Q13), and multivariable adjustment for age, hypertension, diabetes and admission period (Q14). It is downgraded from Good, but not to Poor, by two items: Q5 (no sample-size justification, power description or a priori variance/effect estimate - explicitly not a fatal flaw per the tool) and Q12 (blinding of outcome assessors is not reported; data were collected by two of the study authors, relevant because the primary outcome is an echocardiographic interpretation and inotrope decision). Additional concern, acknowledged by the authors, is residual confounding by co-interventions that changed in step with the exposure - proning on ECMO (22.7% vs. 0%) and a higher BMI in the optimal-PEEP group - which was not statistically adjusted for, together with the calendar-time (before/after) structure of the comparison; these lower confidence in the association without constituting a fatal design flaw."
  }
}
