{
  "record_meta": {
    "study_id": "sutherasan_2025",
    "reviewer": "deepseek",
    "model": "deepseek-v4-flash-vision-exp",
    "assessment_date": "2026-09-28",
    "source_file": "studies/fulltext/fmed-12-1642064.pdf",
    "schema_version": "1.0.0"
  },
  "study_id": "sutherasan_2025",
  "tool": "nih_before_after",
  "results": [],
  "nih": {
    "items": {
      "1": {
        "response": "Yes",
        "support": "Our primary objective was to compare OP values determined by five distinct methods",
        "location": "Page 2, Introduction (and abstract, page 1)"
      },
      "2": {
        "response": "Yes",
        "support": "Patients aged 18 years or older who had moderate to severe ARDS according to the Berlin classification were included in the study (14). Exclusion criteria included contraindications to EIT (e.g., presence of a pacemaker or automatic intracardiac defibrillator), pregnancy, ongoing intercostal drainage, and chronic obstructive lung disease.",
        "location": "Page 2, section 2.1 Patients; study setting and period in section 2 Materials and methods"
      },
      "3": {
        "response": "Yes",
        "support": "Patients aged 18 years or older who had moderate to severe ARDS according to the Berlin classification were included in the study (14)",
        "location": "Page 2, section 2.1; Table 1, page 5 (PaO2/FiO2 115.16 ± 28.17 mm Hg; 17 moderate (81%) and 4 severe (19%) ARDS)"
      },
      "4": {
        "response": "No",
        "support": "Eligible patients (N=39) ... Excluded (N=13): Not met inclusion criteria N=3; Contraindication for lung RM N=9; Incomplete consent form N=1",
        "location": "Figure 1, protocol flow chart, page 3"
      },
      "5": {
        "response": "Yes",
        "support": "Assuming a large effect size (f = 1.0), α = 0.05, 80% power, and five independent groups, a total of 20 participants was required. Under these parameters, the noncentrality parameter (λ) was 20.00, the critical F-value was 3.06 (df₁ = 4; df₂ = 15), and the achieved power was 0.88.",
        "location": "Page 4, section 4 Statistical analysis"
      },
      "6": {
        "response": "Yes",
        "support": "After RM, PCV was maintained with a fixed inspiratory pressure of 15 cm H₂O above PEEP, and PEEP was decreased from 20 cm H₂O to 8 cm H₂O in 2 cm H₂O steps at one-minute intervals.",
        "location": "Page 3, section 2.2.3 Recruitment maneuver and decremental PEEP titration"
      },
      "7": {
        "response": "Yes",
        "support": "The percentages of alveolar collapse and overdistension determined by EIT were recorded. Additionally, breath-by-breath EIT data were collected and analyzed offline.",
        "location": "Page 3, section 2.2.2; outcome criteria listed on page 4, section 3 Outcomes"
      },
      "8": {
        "response": "NR",
        "support": "The report does not describe blinding of the persons assessing outcomes; parameters were recorded from the ventilator during the PEEP trial and EIT data were analyzed offline by the study investigators.",
        "location": "Pages 3–4, sections 2.2.2–2.2.3 and 4 (no statement on blinding anywhere in the report)"
      },
      "9": {
        "response": "Yes",
        "support": "Among thirty-nine patients, twenty-six were eligible. Four patients were excluded due to hemodynamic instability during RM, and one patient had incomplete EIT data. Twenty-one patients were included in the final analysis.",
        "location": "Page 4, section 5.1 Baseline characteristics; Figure 1 flow chart, page 3"
      },
      "10": {
        "response": "Yes",
        "support": "Repeated-measures ANOVA with Greenhouse–Geisser correction analyzed variables during PEEP titration.",
        "location": "Page 4, section 4 Statistical analysis; pre- vs post-RM SpO₂/FiO₂ comparison in section 5.1"
      },
      "11": {
        "response": "Yes",
        "support": "At zero flow ... After 1 min at each PEEP level, the following parameters were recorded",
        "location": "Page 3, section 2.2.3 (recording at each 2 cm H₂O step from 20 to 8 cm H₂O); page 8, section 7 (147 measurements from 21 patients)"
      },
      "12": {
        "response": "NA",
        "support": "The intervention (decremental PEEP titration guided by esophageal pressure, lung mechanics or EIT) was applied at the individual patient level, so a group-level analysis was not applicable.",
        "location": "Page 3, section 2.2.3; page 4, section 3 Outcomes"
      }
    },
    "rating": "Fair",
    "rationale": "The study asks a clear question (item 1), prespecifies eligibility (item 2) in a representative moderate-to-severe ARDS ICU population (item 3), reports an a priori sample-size calculation with 88% achieved power (item 5), describes the esophageal-pressure-guided PEEP protocol in detail and applies it identically to every patient (item 6), uses prespecified, objective, repeatedly measured outcomes (items 7 and 11) with formal statistical testing of pre-to-post changes (item 10), and reports complete short-term data with losses under 20% documented (item 9). It is rated Fair rather than Good because not all eligible patients were enrolled (13 of 39 excluded, including 9 for recruitment-maneuver contraindication, item 4 = No), no blinding of outcome assessors is reported (item 8 = NR), and the sample is small, single-centre and physiological, with the authors acknowledging that the 1-minute PEEP steps may not allow full stabilization of respiratory mechanics; these limitations introduce some bias but do not invalidate the reported physiological findings. Item 12 was not applicable because the intervention was applied at the individual patient level."
  }
}
