{
  "record_meta": {
    "study_id": "chow_2025",
    "reviewer": "deepseek",
    "model": "deepseek-v4-flash-vision-exp",
    "assessment_date": "2026-09-28",
    "source_file": "studies/fulltext/iraf119.pdf",
    "schema_version": "1.0.0"
  },
  "study_id": "chow_2025",
  "tool": "nih_before_after",
  "results": [],
  "nih": {
    "items": {
      "1": {
        "response": "Yes",
        "support": "The aim of this study was to report on a single institution's use of esophageal pressure monitoring in burn-injured patients with worsening ARDS despite aggressive interventions, and to examine changes in ventilator and optimal PEEP settings, and secondarily, in oxygenation trends and ARDS resolution.",
        "location": "p. 1256, end of Introduction (last paragraph before Methods)"
      },
      "2": {
        "response": "Yes",
        "support": "Adult patients with severe burn injuries with or without smoke inhalation injury admitted to an ABA-verified burn center from January 2017 to May 2024 were retrospectively reviewed for those who received mechanical ventilation for greater than 48 h and developed ARDS by the Berlin definition.",
        "location": "p. 1256, Methods, first paragraph"
      },
      "3": {
        "response": "Yes",
        "support": "Adult patients with severe burn injuries with or without smoke inhalation injury admitted to an ABA-verified burn center ... who received mechanical ventilation for greater than 48 h and developed ARDS by the Berlin definition; patients were severely injured with a median (IQR) percent total body surface area (TBSA) burned of 39.8% (25.9-59.0).",
        "location": "p. 1256, Methods and p. 1258, Results, first paragraph"
      },
      "4": {
        "response": "Yes",
        "support": "During the study period, 28 patients were identified who met inclusion criteria and underwent esophageal pressure (Pes) monitoring to guide mechanical ventilation.",
        "location": "p. 1257, Results, first paragraph"
      },
      "5": {
        "response": "No",
        "support": "This was a single-center retrospective study with a small sample size, and as a result is not necessarily generalizable to the wider population. ... the authors recognize that the retrospective and low-powered nature of this study prevents formal recommendations or management guidelines pertaining to its use to be made.",
        "location": "p. 1260, Discussion, limitations paragraph"
      },
      "6": {
        "response": "Yes",
        "support": "A 16 Fr adult orogastric tube with an inflatable esophageal balloon was used (SmartCath Nasogastric Tube, Carefusion, Yorba Linda, CA). The tube was attached to a pressure transducer and connected to a bedside monitor. With the patient supine, at approximately 30 degrees, the pressure transducer was zeroed at the phlebostatic axis.",
        "location": "p. 1256, Methods, 'Esophageal manometry technique'; PEEP rules on p. 1257"
      },
      "7": {
        "response": "Yes",
        "support": "the ratio of PaO2 to the fractioned of inspired oxygen (FiO2) (P/F ratio) and oxygenation indices (OI) [(FiO2 x mean airway pressure (MAP))/PaO2] were calculated to compare the severity of hypoxia prior to esophageal pressure monitoring use, and at 1, 3, and 5-day intervals following manometry initiation.",
        "location": "p. 1257, Data collection and analysis; Tables 3 and 4, pp. 1258-1259"
      },
      "8": {
        "response": "No",
        "support": "I looked for any statement that the persons assessing ventilator settings, P/F ratios, oxygenation indices or ARDS resolution were masked to patients' exposure to Pes monitoring; the report describes a retrospective review of the electronic medical record with no blinding described anywhere.",
        "location": "Methods, Data collection and analysis, pp. 1256-1257; no blinding statement found"
      },
      "9": {
        "response": "Yes",
        "support": "Among these, 5 patients died within 48 h of esophageal pressure (Pes) monitoring and were excluded from the analysis (5 of 28 = 17.9% not carried into the analysis, i.e. 82.1% retained, and the reason for their exclusion is stated).",
        "location": "p. 1257, Results, first paragraph; Table 2, p. 1259"
      },
      "10": {
        "response": "Yes",
        "support": "For changes in ventilator settings, normally distributed data were tested for the mean difference between timepoints using the paired t-test. Non-normally distributed data were tested for differences between timepoints using the Wilcoxon signed-rank test. ... a mixed-effect model for repeated measures followed by Tukey's post-hoc test was used",
        "location": "p. 1257, Statistical analysis; p-values in Tables 2-4 and Figures 1-3"
      },
      "11": {
        "response": "No",
        "support": "Generally, values were obtained upon insertion of the esophageal manometry device to establish baseline values to guide ventilator observations and changes. Additional measurements were obtained every 24 h afterwards or following significant events (a single pre-intervention measurement with repeated post-intervention measurements, not an interrupted time series).",
        "location": "p. 1257, Esophageal manometry technique / Data collection and analysis; Table 4, p. 1259"
      },
      "12": {
        "response": "NA",
        "support": "The intervention (esophageal-pressure-guided PEEP titration) was delivered to individual mechanically ventilated patients, and the report describes no group-level or unit-level intervention, so a group-level analysis question does not arise.",
        "location": "Methods, pp. 1256-1257; tool guidance for Q12"
      }
    },
    "rating": "Fair",
    "rationale": "Rated Fair. Strengths: clearly stated objective (Q1), prespecified and clearly described eligibility criteria (Q2), a cohort representative of the clinical population of interest, i.e. severely burn-injured adults with ARDS (Q3), complete reporting of the flow of eligible patients (Q4), a detailed and consistently applied Pes-guided PEEP protocol with explicit formulas (Q6), objective and clearly defined outcome measures (PEEP, P/F ratio, OI, ARDS resolution; Q7), follow-up of 82% with the 5 excluded deaths accounted for (Q9), and appropriate pre-post statistical testing with p-values (Q10). Downgrades: sample size of only 23 patients with no power calculation and the authors' own acknowledgement of a low-powered study (Q5, No); no blinding of outcome assessors in a retrospective chart review (Q8, No); and no interrupted time-series design, with only a single baseline measurement (Q11, No). The single-arm retrospective before-after design with no control group and no multiple baseline measurements leaves residual risk that the observed PEEP and oxygenation changes reflect natural ARDS course or co-interventions, but this was explicitly acknowledged and no fatal flaw was identified, so the study is judged Fair rather than Poor."
  }
}
