{
  "study_id": "chow_2025",
  "tool": "nih_before_after",
  "results": [],
  "nih": {
    "items": {
      "1": {
        "response": "Yes",
        "support": "The aim of this study was to report on a single institution's use of esophageal pressure monitoring in burn-injured patients with worsening ARDS",
        "location": "Page 2, Introduction (end) / Methods"
      },
      "2": {
        "response": "Yes",
        "support": "Adult patients with severe burn injuries with or without smoke inhalation injury admitted to an ABA-verified burn center from January 2017 to May 2024 ... Patients less than 18 years of age, died prior to manometry placement or were designated as comfort care",
        "location": "Page 2, Methods"
      },
      "3": {
        "response": "Yes",
        "support": "Patients were severely injured with a median (IQR) percent total body surface area (TBSA) burned of 39.8% (25.9-59.0), revised Baux score of 91.6",
        "location": "Page 4, Results; Table 1"
      },
      "4": {
        "response": "CD",
        "support": "Per institution protocol, patients who developed ARDS and had worsening oxygenation ... underwent esophageal pressure monitoring; whether every eligible patient actually received Pes during 2017-2024 cannot be determined retrospectively.",
        "location": "Page 2, Methods"
      },
      "5": {
        "response": "No",
        "support": "This was a single-center retrospective study with a small sample size, and as a result is not necessarily generalizable to the wider population",
        "location": "Page 6, Discussion (limitations); no sample size/power calculation reported in Statistical analysis, page 3"
      },
      "6": {
        "response": "Yes",
        "support": "A 16 Fr adult orogastric tube with an inflatable esophageal balloon was used (SmartCath Nasogastric Tube, Carefusion, Yorba Linda, CA)... advanced orally into the mid-lower third of the esophagus",
        "location": "Page 2, Esophageal manometry technique"
      },
      "7": {
        "response": "Yes",
        "support": "The primary outcomes sought in this study were to assess necessary ventilatory changes guided by esophageal pressure monitoring. Additional secondary outcomes of interest included trends in oxygenation and resolution of ARDS.",
        "location": "Page 3, left column, end of manometry section"
      },
      "8": {
        "response": "No",
        "support": "No blinding or masking of outcome assessors is described anywhere in the report; in this retrospective review the investigators assessing outcomes were part of the care team aware of Pes status.",
        "location": "Whole report, Methods and Data collection and analysis (pages 2-3); absence of any blinding statement"
      },
      "9": {
        "response": "Yes",
        "support": "as not all patients had outcomes of interest at each time point, a mixed-effect model for repeated measures followed by Tukey's post-hoc test was used",
        "location": "Page 3, Statistical analysis"
      },
      "10": {
        "response": "Yes",
        "support": "For oxygenation trends ... a mixed-effect model for repeated measures followed by Tukey's post-hoc test was used to examine differences at the 4 time points in the least square means of the P/F ratio and PEEP",
        "location": "Page 3, Statistical analysis; Tables 3-4"
      },
      "11": {
        "response": "No",
        "support": "Oxygenation was determined prior to Pes use, and at 1-, 3- and 5-day intervals following initiation; only a single pre-intervention measurement is reported, not multiple pre-intervention measures (interrupted time-series).",
        "location": "Page 1, Abstract; Table 4, page 5"
      },
      "12": {
        "response": "NA",
        "support": "The intervention (esophageal pressure monitoring-guided PEEP titration) was applied at the individual patient level, not at a group level.",
        "location": "Page 2, Methods"
      }
    },
    "rating": "Fair",
    "rationale": "Fair rather than Good because of key weaknesses: the sample was small with no power calculation (item 5), not all eligible patients could be confirmed enrolled (item 4, CD), outcome assessors were not blinded (item 8), and there was only a single pre-intervention measurement rather than an interrupted time-series design (item 11), so the observed oxygenation improvements could reflect the natural course of ARDS as the authors themselves acknowledge. Strengths included clearly stated objectives and eligibility criteria (items 1-2), a well-described and consistently applied intervention (item 6), valid objective outcomes (item 7), and appropriate paired statistical testing with p values (item 10); the study was otherwise complete with no attrition (item 9), which prevents a Poor rating."
  },
  "record_meta": {
    "study_id": "chow_2025",
    "reviewer": "glm",
    "model": "glm-5.3-flash",
    "assessment_date": "2026-09-28",
    "source_file": "studies/fulltext/iraf119.pdf",
    "schema_version": "1.0.0"
  }
}
