{
  "record_meta": {
    "study_id": "liou_2022",
    "reviewer": "glm",
    "model": "glm-5.3-flash",
    "assessment_date": "2026-09-28",
    "source_file": "studies/fulltext/retrospective_review_of_transpulmonary_pressure.3.pdf",
    "schema_version": "1.0.0"
  },
  "study_id": "liou_2022",
  "tool": "nih_before_after",
  "results": [],
  "nih": {
    "items": {
      "1": {
        "response": "Yes",
        "support": "We sought to determine the feasibility and impact of implementation of a protocol for use of esophageal balloon to set PEEP in obese patients in a community ICU.",
        "location": "Page 1, OBJECTIVES"
      },
      "2": {
        "response": "Yes",
        "support": "All adult patients 18 years old or older requiring mechanical ventilation with class II and III obesity (BMI ≥ 35 kg/m2) with ARDS were eligible.",
        "location": "Page 2, MATERIALS AND METHODS"
      },
      "3": {
        "response": "Yes",
        "support": "Twenty-nine mechanically ventilated adult patients with a median BMI of 45.8 kg/m2 with acute respiratory distress syndrome (ARDS).",
        "location": "Page 1, PATIENTS"
      },
      "4": {
        "response": "CD",
        "support": "The report states 48 balloons were placed and 29 met inclusion criteria, but does not report how many eligible obese ARDS patients were not selected or whether all eligible patients received a balloon.",
        "location": "Page 3, RESULTS"
      },
      "5": {
        "response": "No",
        "support": "as a single-center study in a community setting, we were limited in sample size and may not be generalizable to all ICU settings.",
        "location": "Page 7, DISCUSSION"
      },
      "6": {
        "response": "Yes",
        "support": "The esophageal catheter used was the CooperSurgical 5F catheter, 47-9005... PEEP was titrated based on PL at end expiration (End Exp PL) until it approached 0 (±2) cm H2O",
        "location": "Page 2, MATERIALS AND METHODS"
      },
      "7": {
        "response": "Yes",
        "support": "Outcomes measured include PEEP, oxygenation, and driving pressure (DP) before and after esophageal manometry at 4 and 24 hr.",
        "location": "Page 1, MEASUREMENTS AND MAIN RESULTS"
      },
      "8": {
        "response": "No",
        "support": "Data were extracted directly from the electronic medical records by investigators.",
        "location": "Page 3, MATERIALS AND METHODS"
      },
      "9": {
        "response": "Yes",
        "support": "Comparison of ventilator settings between baseline, 4 hours, and 24 hours are shown in Table 2.",
        "location": "Page 4, RESULTS; Table 2"
      },
      "10": {
        "response": "Yes",
        "support": "A Wilcoxon signed rank test was used to assess the difference in the PEEP, S/F ratios, Fio2, and driving pressure (DP) pre- and postesophageal balloon placements at 4 and 24 hours.",
        "location": "Page 3, MATERIALS AND METHODS"
      },
      "11": {
        "response": "No",
        "support": "Ventilator settings, ventilator pressures, and hemodynamic vasopressor support were obtained before esophageal balloon placement and after optimization at 4 and 24 hours.",
        "location": "Page 3, MATERIALS AND METHODS"
      },
      "12": {
        "response": "NA",
        "support": "The intervention (esophageal-manometry-guided PEEP titration) was applied at the individual patient level, not at a group level.",
        "location": "Page 2, MATERIALS AND METHODS"
      }
    },
    "rating": "Fair",
    "rationale": "Rating Fair: the study question was clear (item 1), eligibility criteria were prespecified (item 2), patients were representative of the target obese ARDS population (item 3), the intervention was protocolized and consistently delivered (item 6), outcomes were objective physiological measures (item 7), complete 24-hour follow-up was achieved (item 9), and formal pre-to-post statistical testing with p values was performed (item 10). It is not Good because there was no power/sample size justification for the small n=29 cohort (item 5), no blinding of outcome assessors in this retrospective chart review (item 8), only a single pre-intervention measurement rather than an interrupted time-series design (item 11), and enrollment of all eligible patients could not be determined (item 4)."
  }
}
