{
  "record_meta": {
    "study_id": "rowley_2021",
    "reviewer": "deepseek",
    "model": "deepseek-v4-flash-vision-exp",
    "assessment_date": "2026-09-28",
    "source_file": "studies/fulltext/EBSCO-FullText-06_26_2026.pdf",
    "schema_version": "1.0.0"
  },
  "study_id": "rowley_2021",
  "tool": "nih_before_after",
  "results": [],
  "nih": {
    "items": {
      "1": {
        "response": "Yes",
        "support": "We aimed to determine whether PL-guided LPV settings, pulmonary mechanics, and oxygenation improve and differ from non-PL-guided LPV among obese patients after 24 h on mechanical ventilation.",
        "location": "p 1049, Abstract (Background); also Introduction, p 1049"
      },
      "2": {
        "response": "Yes",
        "support": "Adult patients ≥ 18 y old who met the following criteria were included in our analysis: BMI ≥ 30 kg/m2, admission to the medical ICU or surgical/trauma ICU, need for mechanical ventilation, and a respiratory therapy consult to obtain PL measurements by a licensed independent practitioner",
        "location": "p 1050, Methods, Patients"
      },
      "3": {
        "response": "Yes",
        "support": "Our analysis consisted of 20 subjects (13 male) who were morbidly obese (Class 3) with a median BMI of 47.5 kg/m2 (IQR 37.4–55.7). Most subjects were cared for in our medical ICU (n = 14)",
        "location": "p 1051, Results (Table 1, p 1051)"
      },
      "4": {
        "response": "CD",
        "support": "The report states 'A total of 20 patients between April 2019 and July 2020 were found to be eligible for analysis' but does not report how many patients were screened, how many were excluded, or whether all eligible patients were enrolled.",
        "location": "p 1050, Methods, Patients"
      },
      "5": {
        "response": "No",
        "support": "Second, our sample size was relatively small due to being a single-center retrospective analysis.",
        "location": "p 1056, Discussion, Limitations"
      },
      "6": {
        "response": "Yes",
        "support": "Mechanical ventilator settings were adjusted to target an inspiratory PL < 20 cm H2O and an expiratory PL target of 0–6 cm H2O. A FIO2/PL table ... was used to determine optimal expiratory PL in relationship to set FIO2.",
        "location": "p 1051, Methods, Procedure and Measurements"
      },
      "7": {
        "response": "Yes",
        "support": "Mechanical ventilator settings, airway pressures, pulmonary mechanics, and oxygenation variables were recorded immediately before PL-guided LPV and 24 h after PL guided LPV. Berlin classification for mild hypoxemia ... was also recorded.",
        "location": "p 1051, Methods, Procedure and Measurements"
      },
      "8": {
        "response": "No",
        "support": "No blinding of outcome assessors is described: 'Data were collected from electronic medical records by study investigators (DDR and SA) and transferred to SPSS 25 ... for storage and analysis.'",
        "location": "p 1051, Methods, Statistical Analysis"
      },
      "9": {
        "response": "Yes",
        "support": "Data are presented as median (interquartile range) or n (%). N = 20 subjects.",
        "location": "p 1052, Table 2 footnote (all before-after variables reported for N = 20)"
      },
      "10": {
        "response": "Yes",
        "support": "Repeat measures for before PL and after PL measurements were compared using the Wilcoxon signed-rank test.",
        "location": "p 1051, Methods, Statistical Analysis (results with P values in Table 2, p 1052)"
      },
      "11": {
        "response": "No",
        "support": "Mechanical ventilator settings, airway pressures, pulmonary mechanics, and oxygenation variables were recorded immediately before PL-guided LPV and 24 h after PL guided LPV.",
        "location": "p 1051, Methods, Procedure and Measurements; Fig. 4 (SpO2/FIO2 at baseline, 24, 48, 72, 96 h), p 1055"
      },
      "12": {
        "response": "NA",
        "support": "The intervention assessed (PL-guided ventilator setting adjustment, with esophageal balloon manometry and individualized PEEP/VT targets) was applied at the individual patient level, not at a group level, so a group-level analysis question does not apply.",
        "location": "p 1051, Methods, Procedure and Measurements"
      }
    },
    "rating": "Fair",
    "rationale": "Items driving the rating: Q5 No (n = 20 single-center sample with no sample-size or power justification, acknowledged by the authors as relatively small), Q8 No (outcome data collected by unblinded study investigators, with no masking of assessors), Q11 No (only a single measurement immediately before and one 24 h after the intervention, rather than an interrupted time-series), and Q4 CD (no account of how many patients were screened or whether all eligible patients were enrolled). Counterbalancing strengths supporting Fair rather than Poor: Q1/Q2 Yes (clear objective and explicit inclusion/exclusion criteria), Q3 Yes (Class 3 obese ICU patients receiving mechanical ventilation, the clinical population for whom PL-guided LPV is proposed), Q6 Yes (intervention targets and FIO2/PL titration table clearly described; catheter positioning validated by occlusion manoeuvre and standardised protocol), Q7 Yes (objective, consistently recorded ventilator, mechanics and oxygenation measures), Q9 Yes (complete before/after data for all 20 subjects), Q10 Yes (Wilcoxon signed-rank tests with reported P values for the pre-post changes). These flaws raise doubt about attribution of the observed changes to PL-guided LPV, but they do not invalidate the well-documented physiological comparisons, so the study is rated Fair."
  }
}
