{
  "record_meta": {
    "study_id": "fumagalli_2019",
    "reviewer": "deepseek",
    "model": "deepseek-v4-flash-vision-exp",
    "assessment_date": "2026-09-28",
    "source_file": "studies/fulltext/lung_recruitment_in_obese_patients_with_acute.25.pdf",
    "schema_version": "1.0.0"
  },
  "study_id": "fumagalli_2019",
  "tool": "nih_before_after",
  "results": [],
  "nih": {
    "items": {
      "1": {
        "response": "Yes",
        "support": "We hypothesized that lungs of severely obese patients with ARDS are highly recruitable and that a recruitment maneuver would improve lung mechanics, distribution of ventilation, dead space fraction and oxygenation while avoiding lung overdistention.",
        "location": "Page 792, Introduction (final paragraph)"
      },
      "2": {
        "response": "Yes",
        "support": "severely obese adult patients (body mass index greater than 35 kg/m2) admitted to the Medical or Surgical intensive care units of the Massachusetts General Hospital (Boston, Massachusetts) entered the study after written informed consent was obtained.",
        "location": "Page 792, Study Population; also Materials and Methods (registration NCT02503241)"
      },
      "3": {
        "response": "Yes",
        "support": "Fourteen severely obese patients (body mass index = 58.6 ± 11.0 kg/m2) matched the Berlin definition criteria for ARDS diagnosis.",
        "location": "Page 794, Results, and Table 1"
      },
      "4": {
        "response": "No",
        "support": "Among the latter cohort, 30 patients met the inclusion criteria, 28 patients were approached to obtain consent (2 patients excluded for logistical reasons), and 24 patients were enrolled and completed the study procedures.",
        "location": "Page 794, Results (first paragraph)"
      },
      "5": {
        "response": "Yes",
        "support": "We anticipated enrolling 14 patients in this two-treatment crossover study based on an expected decrease in lung elastance of 1.7 ± 1.8 cm H2O/l at PEEPDECREMENTAL versus PEEPINCREMENTAL, with a power of 90% and a two-sided 0.05 significance level.",
        "location": "Page 794, Statistical Analysis"
      },
      "6": {
        "response": "Yes",
        "support": "The study protocol had three phases, always performed in the following order (fig. 1)",
        "location": "Page 792, Study Procedures (phases also detailed on page 792 and in figure 1, page 793)"
      },
      "7": {
        "response": "Yes",
        "support": "Lung collapse and overdistension percentages were determined by comparing each electrical impedance tomography pixel-compliance during PEEPARDSnet, PEEPINCREMENTAL, and PEEPDECREMENTAL ventilation.",
        "location": "Page 793, Electrical Impedance Tomography Lung Imaging (mechanics and gas exchange sections pp. 793-794; Table 2)"
      },
      "8": {
        "response": "No",
        "support": "Blinding is described only for the radiologist reading the chest radiographs (blinded to the order of image acquisition); the report does not state that the persons measuring respiratory mechanics, gas exchange or electrical impedance tomography were blinded to the PEEP strategy.",
        "location": "Page 794, Radiologic Imaging; measurements described on pages 792-794"
      },
      "9": {
        "response": "Yes",
        "support": "All patients completed the entire study procedures and were ventilated at titrated PEEPDECREMENTAL level for at least 24 h after the study procedures.",
        "location": "Page 796, Titrated PEEP Levels Were Hemodynamically Well Tolerated; also page 795 (\"No data was missing on any patient unless specifically reported\")"
      },
      "10": {
        "response": "Yes",
        "support": "Continuous variables were compared by one-way ANOVA for repeated measure, and whenever a difference between groups was detected, intergroup comparison was performed with paired Student's t tests.",
        "location": "Page 794, Statistical Analysis; results with P values in Table 2 (page 795) and figures 2-6"
      },
      "11": {
        "response": "No",
        "support": "All measurements during PEEPARDSnet, PEEPINCREMENTAL, and PEEPDECREMENTAL were performed at steady state after 10 to 15 min on stable ventilatory settings.",
        "location": "Page 792, Measurements; figure 1 (page 793)"
      },
      "12": {
        "response": "NA",
        "support": "The intervention (PEEP titration according to esophageal pressure or to a decremental trial) was applied at the level of the individual patient, not at a group or cluster level, so no group-level analysis question applies.",
        "location": "Pages 792-793, Study Procedures and figure 1"
      }
    },
    "rating": "Fair",
    "rationale": "Driving the rating: item 4 (only 24 of 30 eligible patients enrolled, with 2 excluded for logistical reasons), item 8 (no blinding of the assessors of the primary physiologic outcomes - respiratory mechanics, gas exchange and electrical impedance tomography - although chest radiographs were read blinded), and item 11 (no interrupted time-series design; single measurement at each of three PEEP phases). These are compounded by a small single-centre sample of 14 patients and by the explicitly acknowledged non-randomized, fixed order of the three PEEP strategies with potential carry-over (\"The order of the study procedures was not randomized\"). Offsetting strengths were the clearly stated objective (item 1), prespecified, registered population and protocol (items 2 and 6), objective and validated outcome measures (item 7), complete follow-up with no missing data (item 9), and appropriate repeated-measures statistics with p values for the pre-to-post changes (item 10). Overall quality is Fair: a well-conducted but small, unblinded physiologic before-after study whose internal validity is limited by selection and order effects rather than by any single fatal flaw."
  }
}
