{
  "record_meta": {
    "study_id": "tonelli_2023",
    "reviewer": "deepseek",
    "model": "deepseek-v4-flash-vision-exp",
    "assessment_date": "2026-09-28",
    "source_file": "studies/fulltext/s13054-023-04682-5.pdf",
    "schema_version": "1.0.0"
  },
  "study_id": "tonelli_2023",
  "tool": "nih_before_after",
  "results": [],
  "nih": {
    "items": {
      "1": {
        "response": "Yes",
        "support": "We aimed at describing the physiological effect of lung-protective ventilation in patients with AE-ILD-UIP compared with primary ARDS.",
        "location": "Page 1, Abstract (Background/Methods)"
      },
      "2": {
        "response": "Yes",
        "support": "Inclusion criteria were age > 18 years; established diagnosis of ILD with a UIP pattern on a high-resolution computed tomography scan; invasive MV in volume-controlled mode. Patients suffering from chronic obstructive pulmonary disease, neuromuscular disease and chest wall deformities were excluded.",
        "location": "Page 2, Methods — Study setting and population"
      },
      "3": {
        "response": "Yes",
        "support": "Patients with AE-ILD-UIP developing AHRF and consecutively admitted to the RICU (August 1st, 2016, to July 1st, 2022) were eligible for enrollment.",
        "location": "Page 2, Methods — Study setting and population"
      },
      "4": {
        "response": "CD",
        "support": "Over the study period a total of 21 patients with AE-ILD-UIP underwent MV. Of these, 10 patients were analyzed according to inclusion criteria; the report does not state how many of the 21 met the entry criteria or why the remainder were not analyzed.",
        "location": "Page 3, Results — Respiratory mechanics of AE-ILD-UIP"
      },
      "5": {
        "response": "No",
        "support": "Ten AE-ILD-UIP patients and 10 matched ARDS were included ... Our study suffers from limitations: the small sample ... allow only preliminary pathophysiological insights. No sample size or power calculation is reported.",
        "location": "Page 1, Abstract (Results) and page 4, Discussion (limitations)"
      },
      "6": {
        "response": "Yes",
        "support": "According to our institutional protocol, patients with AE-ILD-UIP or ARDS requiring MV were submitted to a partitioned respiratory mechanics measurements within 24 h from admission during three different lung-protective strategies including low VT (6 ml/Kg/PBW) and three consecutive PEEP levels.",
        "location": "Page 2, Methods — Study procedures and aim"
      },
      "7": {
        "response": "Yes",
        "support": "At each phase, PEEP level was maintained for 30 min before recording all respiratory parameters and arterial blood sampling (see details in Additional file 1: Supplement [9, 10]).",
        "location": "Page 2, Methods — Study procedures and aim; Table 1, page 3"
      },
      "8": {
        "response": "No",
        "support": "I searched the methods, study-procedure and data-collection sections for any statement that the persons assessing respiratory mechanics or blood gases were masked to the PEEP level, and found none; the same investigators enrolled patients and analyzed the data.",
        "location": "Page 2, Methods — Study procedures and aim; page 6, Author contributions"
      },
      "9": {
        "response": "Yes",
        "support": "Measured individual values of EL, PL,EE, PL,EI and ΔPL the matched study groups at ZEEP, PEEPLOW and PEEPTITRATED phase — individual data are displayed for all 10 patients per group at all three phases, so no participant was lost after baseline.",
        "location": "Fig. 1, pages 4–5"
      },
      "10": {
        "response": "Yes",
        "support": "Comparison between continuous variables was performed with Wilcoxon and Wilcoxon signed-rank tests ... ΔPL significantly decreased from baseline (p = 0.018) ... EL significantly increased as compared to both ZEEP and PEEPLOW (p = 0.04 and p < 0.0001, respectively).",
        "location": "Page 2–3, Data collection and analysis plan; page 3, Results"
      },
      "11": {
        "response": "No",
        "support": "three PEEP levels (zero = ZEEP, 4–8 cmH2O = PEEPLOW, and titrated to achieve positive end-expiratory transpulmonary pressure PL,EE = PEEPTITRATED) were used for measurements — a single measurement at each of three phases, not repeated before-and-after measurement series.",
        "location": "Page 1, Abstract (Methods); page 2, Study procedures and aim"
      },
      "12": {
        "response": "NA",
        "support": "The intervention (esophageal-pressure-guided PEEP setting) was applied at the individual patient level; no group- or cluster-level intervention or corresponding analysis is described in the report.",
        "location": "Page 2, Methods — Study procedures and aim"
      }
    },
    "rating": "Fair",
    "rationale": "Question 1 (objective), 2 (eligibility criteria prespecified and described), 3 (consecutive ventilated AE-ILD-UIP patients plus matched ARDS controls), 6 (PEEP protocol clearly described and applied uniformly: low VT, ZEEP, PEEPLOW, PEEPTITRATED, each phase 30 min), 7 (objective, protocol-based partitioned respiratory mechanics measured the same way in every patient), 9 (complete data for all patients at all phases) and 10 (Wilcoxon signed-rank tests with p values for pre-post changes) were all met, giving a low risk of bias for selection, intervention delivery, measurement and analysis. The rating is downgraded to Fair by Question 5 (No: 10 patients per group, no sample size or power calculation, authors themselves cite the 'small sample'), Question 8 (No: no masking of outcome assessors reported) and Question 11 (No: single measurement at each of three PEEP levels rather than an interrupted time-series), with Question 4 coded CD because the report does not state how many of the 21 ventilated AE-ILD-UIP patients met the entry criteria. These are imprecision and design limitations rather than a fatal flaw, so the study is not rated Poor."
  }
}
