{
  "study_id": "gibot_2021",
  "tool": "nih_before_after",
  "results": [],
  "nih": {
    "items": {
      "1": {
        "response": "Yes",
        "support": "we compared PEEP settings based on PEEP/FiO2 tables, PL/ FiO2 table, and EIT",
        "location": "Page 2, Introduction end"
      },
      "2": {
        "response": "Yes",
        "support": "we enrolled some mechanically ventilated patients who were admitted to our Intensive Care Unit (ICU) because of a COVID-19-related moderate-to-severe ARDS",
        "location": "Page 2, Methods, first paragraph"
      },
      "3": {
        "response": "Yes",
        "support": "Seventeen patients (15 men, 2 women) were enrolled. Median age was 65 (62–71) years, and body mass index was 31.1 (28.5–33.0).",
        "location": "Page 2, Results, first paragraph"
      },
      "4": {
        "response": "CD",
        "support": "The report says 'we enrolled some mechanically ventilated patients' and does not state whether all eligible patients admitted in March 2021 were consecutively enrolled.",
        "location": "Page 2, Methods, first paragraph"
      },
      "5": {
        "response": "No",
        "support": "only 17 patients have been enrolled, precluding any generalization",
        "location": "Page 4, Discussion, limitations"
      },
      "6": {
        "response": "Yes",
        "support": "All patients were ventilated in volume control mode [tidal volume (Vt): 6–7 ml/kg ideal body weight (IBW)]",
        "location": "Page 2, Methods, second paragraph"
      },
      "7": {
        "response": "Yes",
        "support": "values, percentages of relatively collapsed and overdistended lung regions were given by the EIT, and the “best” PEEP (PEEPEIT) was considered as the lowest level associated with the lowest total percentage of the lung silent spaces",
        "location": "Page 2, Methods, last paragraph of left column"
      },
      "8": {
        "response": "No",
        "support": "The report does not describe any blinding of outcome assessors; the same clinical team applied the PEEP maneuvers and recorded respiratory mechanics variables.",
        "location": "Page 2, Methods"
      },
      "9": {
        "response": "Yes",
        "support": "Seventeen patients were enrolled. ... All patients, except for one, were discharged alive.",
        "location": "Page 2, Results, first paragraph"
      },
      "10": {
        "response": "Yes",
        "support": "Data are presented as median (interquartile range) and are compared using Wilcoxon signed-rank test. Bias and limits of agreement between different approaches were calculated with the Bland-Altman approach.",
        "location": "Page 2, Methods, statistics"
      },
      "11": {
        "response": "No",
        "support": "Respiratory mechanics variables were recorded after 10 min at different PEEP levels",
        "location": "Page 2, Methods, second paragraph"
      },
      "12": {
        "response": "NA",
        "support": "The intervention (PEEP titration and measurement maneuvers) was applied at the individual patient level, not at a group level.",
        "location": "Page 2, Methods"
      }
    },
    "rating": "Fair",
    "rationale": "The study question, eligibility criteria, intervention, and outcome measures were clearly described (items 1, 2, 6, 7), all enrolled patients were analyzed (item 9), and appropriate pre-to-post paired statistics with p values were used (item 10). The rating is limited to Fair because the sample was very small with no power justification (item 5, n=17, authors themselves note this precludes generalization), there was no blinding of outcome assessors (item 8), and the design used single measurements at each PEEP level rather than an interrupted time-series (item 11); additionally it could not be determined whether all eligible patients were enrolled (item 4). These weaknesses lower confidence in internal validity but are not fatal flaws for a physiological within-patient comparison."
  },
  "record_meta": {
    "study_id": "gibot_2021",
    "reviewer": "glm",
    "model": "glm-5.3-flash",
    "assessment_date": "2026-09-28",
    "source_file": "studies/fulltext/fmed-08-720920.pdf",
    "schema_version": "1.0.0"
  }
}
